[
  {
    "id": 1,
    "code": "STO-0001",
    "name": "Express El Molinar A Coruña",
    "format": "Express",
    "city": "A Coruña",
    "province": "A Coruña",
    "address": "Calle de Rosalía de Castro, 149, 7º Dcha.",
    "postal_code": "15041",
    "phone": "+34 981 477 049",
    "floor_area_sqm": 360,
    "opened_at": "2006-07-16"
  },
  {
    "id": 2,
    "code": "STO-0002",
    "name": "Express La Almazara Valencia",
    "format": "Express",
    "city": "Valencia",
    "province": "Valencia",
    "address": "Carrer de Extremadura, 76, 3º D",
    "postal_code": "46019",
    "phone": "+34 962 551 415",
    "floor_area_sqm": 378,
    "opened_at": "2010-08-16"
  },
  {
    "id": 3,
    "code": "STO-0003",
    "name": "Hipermercado Los Almendros Melilla",
    "format": "Hipermercado",
    "city": "Melilla",
    "province": "Melilla",
    "address": "Calle Goya, 93",
    "postal_code": "52013",
    "phone": "+34 952 661 003",
    "floor_area_sqm": 5192,
    "opened_at": "2020-08-05"
  },
  {
    "id": 4,
    "code": "STO-0004",
    "name": "Supermercado El Molinar Granada",
    "format": "Supermercado",
    "city": "Granada",
    "province": "Granada",
    "address": "Paseo de las Flores, 158",
    "postal_code": "18030",
    "phone": "+34 958 243 049",
    "floor_area_sqm": 1018,
    "opened_at": "2018-08-27"
  },
  {
    "id": 5,
    "code": "STO-0005",
    "name": "Express Origen Valladolid",
    "format": "Express",
    "city": "Valladolid",
    "province": "Valladolid",
    "address": "Calle de Antonio Machado, 92",
    "postal_code": "47024",
    "phone": "+34 983 716 634",
    "floor_area_sqm": 248,
    "opened_at": "2021-06-20"
  },
  {
    "id": 6,
    "code": "STO-0006",
    "name": "Supermercado Tierra Nuestra Madrid",
    "format": "Supermercado",
    "city": "Madrid",
    "province": "Madrid",
    "address": "Calle Goya, 96, 7º B",
    "postal_code": "28019",
    "phone": "+34 915 195 855",
    "floor_area_sqm": 1615,
    "opened_at": "2003-03-03"
  },
  {
    "id": 7,
    "code": "STO-0007",
    "name": "Supermercado La Almazara Palma",
    "format": "Supermercado",
    "city": "Palma",
    "province": "Baleares",
    "address": "Calle de San Juan, 10, 1º D",
    "postal_code": "07035",
    "phone": "+34 971 113 299",
    "floor_area_sqm": 1539,
    "opened_at": "2021-12-18"
  },
  {
    "id": 8,
    "code": "STO-0008",
    "name": "Express Los Almendros Girona",
    "format": "Express",
    "city": "Girona",
    "province": "Girona",
    "address": "Carrer de la Constitución, 26, 9º Dcha.",
    "postal_code": "17031",
    "phone": "+34 972 601 333",
    "floor_area_sqm": 375,
    "opened_at": "2020-08-07"
  }
]
